<?xml version="1.0" encoding="UTF-8"?>
<DXMessage xmlns:xsi="http://www.w3.org/2001/XMLSchema-instance"
           xsi:noNamespaceSchemaLocation="https://dx.docxchange.ro/schemas/docxchange-message/11112015_1330/docxchange-message.xsd">
   <MessageDate>2015-11-23</MessageDate>
   <MessageTime>15:48:30+02:00</MessageTime>
   <MessageOrigin>RO17275880</MessageOrigin>
   <DocumentReference>123456</DocumentReference>
   <DocumentUID>DXTEST01_099_20151123_01000014</DocumentUID>
   <SupplierReceiverCode>222222</SupplierReceiverCode>
   <DocumentResponse>ACCEPTAT</DocumentResponse>
   <DocumentDetail>
ID factura: DX01_099_20151123_01000014 
Nume fisier: Factura123456_RO222.xml 
Status: Transmis la client 
Mesaj: Factura procesata de platforma DocXchange si livrata la client
</DocumentDetail>
</DXMessage>
