<?xml version="1.0" encoding="UTF-8" standalone="no"?>
<DXMessage xmlns:xsi="http://www.w3.org/2001/XMLSchema-instance" xsi:noNamespaceSchemaLocation="C:/Users/rlixandru/Downloads/docxchange-message.xsd">
	<MessageDate>2024-03-01</MessageDate>
	<MessageTime>13:13:03</MessageTime>
	<MessageOrigin>RO13348610</MessageOrigin>
	<DocumentReference>19521</DocumentReference>
	<DocumentUID>DX01_099_20240301_03001172</DocumentUID>
	<SupplierReceiverCode>114221</SupplierReceiverCode>
	<DocumentResponse>IN ASTEPTARE</DocumentResponse>
	<DocumentDetail>- - FACTURA TRIMISA - Factura trimisa la retailer</DocumentDetail>
</DXMessage>
