<?xml version="1.0" encoding="UTF-8" standalone="no"?>
<DXMessage xmlns:xsi="http://www.w3.org/2001/XMLSchema-instance" xsi:noNamespaceSchemaLocation="C:/Users/rlixandru/Downloads/docxchange-message.xsd">
	<MessageDate>2024-02-02</MessageDate>
	<MessageTime>11:44:03</MessageTime>
	<MessageOrigin>RO33067767</MessageOrigin>
	<DocumentReference>18972</DocumentReference>
	<DocumentUID>DX01_099_20240202_01004052</DocumentUID>
	<SupplierReceiverCode>15121</SupplierReceiverCode>
	<DocumentResponse>RECEPTIONAT</DocumentResponse>
	<DocumentDetail>- - Mesaj preluat de la client - pentru informatii suplimentare va rugam sa-i contactati la sectiunea Suport Tehnic a Portalului WEB Carrefour / Message received from the customer - for additional information please contact them in the Technical Support section of the Carrefour WEB Portal / 1111 - Factura a fost receptionata de sistemul Carrefour.</DocumentDetail>
</DXMessage>
